{
  "identifiant": "m-hm-511",
  "de": {
    "nom": "Julie Perrin",
    "adresse": "julie.perrin@calorelle.example"
  },
  "a": [
    "helene.marchal@calorelle.example"
  ],
  "cc": [],
  "objet": "Devis DV-2026-015 à valider",
  "date": "2026-11-12T16:30:00+01:00",
  "corps": "Hélène,\n\nVoici le devis DV-2026-015 : Christophe Guérin (c-0010), pompe à chaleur air-eau et thermostat, après la visite de Mathieu. Au-delà de 10 000 € TTC, il attend ton accord avant de partir au client.\n\nJulie (FICTIF)",
  "pieces_jointes": [
    {
      "nom": "dv-2026-015.pdf",
      "fichier": "pieces/m-hm-511/dv-2026-015.pdf",
      "taille_octets": 1603
    }
  ],
  "lu": false,
  "en_reponse_a": null,
  "transfere_de": null
}
