{
  "identifiant": "m-cmd-014",
  "de": {
    "nom": "Paul Bocquet",
    "adresse": "paul.bocquet@electricite-billard.example"
  },
  "a": [
    "commandes@negovelle.example"
  ],
  "cc": [],
  "objet": "Commande",
  "date": "2026-07-02T13:50:00+02:00",
  "corps": "Bonjour,\n\nVoici notre commande, à livrer au siège :\n\n- 2 x ELE-10326, Appareil modulaire programmateur hebdomadaire\n- 40 x ELE-10057, Ampoule LED B22 9 W, 4000 K\n\nMerci de nous confirmer la livraison.\n\nCordialement,\nPaul Bocquet\nBillard",
  "pieces_jointes": [],
  "lu": false,
  "en_reponse_a": null,
  "transfere_de": null
}
