{
  "identifiant": "m-ctc-807",
  "de": {
    "nom": "Bastien Royer",
    "adresse": "bastien.royer@courriel.example"
  },
  "a": [
    "contact@calorelle.example"
  ],
  "cc": [],
  "objet": "Candidature : technicien chauffagiste",
  "date": "2026-10-30T09:45:00+01:00",
  "corps": "Bonjour,\n\nTechnicien chauffagiste depuis quatre ans, je vous adresse ma candidature. Mon CV est joint.\n\nBastien Royer (FICTIF)",
  "pieces_jointes": [
    {
      "nom": "CV_Bastien_Royer.pdf",
      "fichier": "pieces/m-ctc-807/CV_Bastien_Royer.pdf",
      "taille_octets": 796
    }
  ],
  "lu": false,
  "en_reponse_a": null,
  "transfere_de": null
}
